isbn,title,authors,overview
9781907677410,"Twilight Of The Gods: A Swedish Waffen-ss Volunteer's Experiences With The 11th Ss-panzergrenadier Division 'nordland', Eastern Front 1944-45",['Thorolf Hillblad'],"Few new personal accounts by Waffen-SS soldiers appear in English; even fewer originate from the multitude of non-German European volunteers who formed such an important proportion of this service's manpower. Twilight of the Gods was originally written in Swedish, and published in Buenos Aires shortly after the end of WWII. Erik Wallin, a Swedish soldier who volunteered for service with the Waffen-SS, and participated in the climactic battles on the Eastern Front during late 1944 and 1945, later telling his story to this book's editor, Thorolf Hillblad.<br>
<br>
Wallin served with the Panzer Reconnaissance Battalion, 11th SS-Panzergrenadier Division Nordland, a unit composed mainly of non-German volunteers, including Danes, Norwegians, and Swedes. The division enjoyed a high reputation for its combat capability, and was always at the focal points of the fighting on the Eastern Front in the last year of the war. During this period it saw combat in the Baltic, in Pomerania, on the Oder, and finally in defence of Berlin, where it was destroyed.<br>
<br>
Erik Wallin served with his unit in all of these locations, and provides the reader with a fascinating glimpse into these final battles. The book is written with a 'no holds barred' approach which will captivate, excite and maybe even shock the reader - his recollections do not evade the brutality of fighting against the advancing Red Army. Twilight of the Gods is destined to become a classic memoir of the Second World War. <br>"
9781933027265,Nicky Epstein's Crocheted Flowers,['Nicky Epstein'],"Following on the success of the best-selling <i>Nicky Epstein’s Knitted Flowers</i>, Epstein gives crocheters a special gift: an equally exquisite collection of over 40 flowers—plus patterns for garments embellished with her floral designs. Featuring a beautiful layout and magnificent photography, this keepsake volume features stitch pattern flowers, petal constructed flowers, cord flowers, and the extremely popular felted flowers. Some make fanciful pieces of jewelry; others can adorn handicrafts for a fabulous finishing touch. Epstein offers yarn suggestions and colors, and encourages crocheters to experiment with all the interesting choices in the market today to create breathtaking corsages and bouquets. Among the pretty garden blossoms: a calla lily, blue and purple pansies, a delicate and lacy white wedding boutonniere, complete with a pearl center; and a selection of floral corkscrews. <br>"
9781906868659,Sweet Home: Over 100 Heritage Desserts And Ideas For Preserving Family Recipes,['Rebecca Miller Ffrench'],"Food writer and stylist Rebecca Ffrench comes from a long line of dessert lovers. She fondly remembers the special bonding time her grandparents had over dessert. The smell of fresh baked brownies transports her back into her mother’s kitchen where there was always some kind of foil-covered treat waiting on the counter. And, even today, she rarely lets the week go by without baking something for her family. Just as she remembers her mother’s warm, chocolatey pudding cake more fondly than her Monday meatloaf, Rebecca wants her own kids’ memories of dessert to be equally vivid. It was this very sense of nostalgia for these family heirloom recipes that planted the seeds for her first cookbook. After the loss of a beloved aunt, Rebecca came into possession of the aunt’s journal. It turned out that this journal was not only filled with memories but also a lifetime of recipes—recipes that would have been lost had they not been recorded and passed on. This inspired Rebecca to begin recording her family’s history and heritage through cakes and cookies, pies and puddings, tarts and treats, and in this book, she includes more than 75 of her family’s favorite “I’m home!” treats, from an ooey-gooey “Go-To” Hot Fudge Pudding Cake to a moist, dense Coconut Bunny Cake that Rebecca’s dad perfected to please his granddaughters. Any recipe you pick from her list sounds lush and tempting: Love Struck Sour Cherry Pie, Norwegian Custard Buns, Spiced Apple Cider Doughnuts, No-Fail Caramel Sauce, Criss-Cross Apricot Coffeecake—the list goes deliciously on and on. Broken down into Preserving, Celebrating, Giving, and Creating, SWEET HOME teaches readers not only how to make delectable desserts, but how to keep your family’s traditions alive. Whether she’s preserving her Norwegian heritage by making Cloudberry Krumkaker Cones, celebrating Halloween with a Spooktacular Cheesecake, giving Kahlua Pound Cake through the post, or creating a new family tradition by making her father’s Chocolate Mudslide Cookies, Rebecca Miller Ffrench shows you how easy—and delicious—it is to make your home a sweet one. Add in the warm and winning headnotes on family and baking, tips to make each dish a success, and a special Baking Notes and Pantry section, and SWEET HOME is a recipe for a dessert classic—the perfect go-to guide for families wanting to preserve their history through recipes and food."
9781933405179,Life 70 Years Of Extraordinary Photography: The Platinum Anniversary Collection,['Editors Of Life'],"For seven decades, LIFE has been thrilling the world with its unrivaled presentation of the very best photography to be found. Here, the editors have assembled the crème de la crème from the magazine's vast collection of images. Because LIFE has always dealt with matters of every sort, the entire spectrum of society is represented in these pages. One after another, there are unforgettable photos from Hollywood's greatest stars, from teh wonders of small-town America, from the terrible wars, as well as from the zestful years of childhood. LIFE has always represented the apex in photojournalism and its roster of great photographers is unequaled."
9781931082792,"Novels And Stories, 1959-1962 (library Of America)",['Philip Roth'],"For the last half century, the novels of Philip Roth have re-energized American fiction and redefined its possibilities. Roth's comic genius, his imaginative daring, his courage in exploring uncomfortable truths, and his assault on political, cultural, and sexual orthodoxies have made him one of the essential writers of our time. By special arrangement with the author, The Library of America now inaugurates the definitive edition of Roth's collected works. This first volume presents <i>Goodbye, Columbus and Five Short Stories</i>, the book that established Roth's reputation on publication in 1959 and for which he won the National Book Award, and his first novel, <i>Letting Go</i> (1962).
<p>The title novella, <i>Goodbye, Columbus</i>, the story of a summer romance between a poor young man from Newark and a rich Radcliffe co-ed, is both a tightly wrought tale of youthful desire and a satiric gem that takes aim at the comfortable affluence of the postwar boom. Here and in the stories that accompany it, including ""The Conversion of the Jews"" and ""Defender of the Faith,"" Roth depicts Jewish lives in 1950s America with an unflinching sharpness of observation.</p>
<p>In <i>Letting Go</i>, a sprawling novel set largely against the backdrop of Chicago in the 1950s, Roth portrays the moral dilemmas of young people cast precipitously into adulthood, and in the process describes a skein of social and family responsibilities as they are brought into focus by issues of marriage, abortion, adoption, friendship, and career. The novel's expansiveness provides a wide scope for Roth's gift for vivid characterization, and in his protagonist Gabe Wallach he creates a nuanced portrait of a responsive young academic whose sense of morality draws him into the ordeals of others with unforeseen consequences.</p>"
9781926812090,An Ecology Of Enchantment: A Year In The Life Of A Garden,['Des Kennedy'],"For the past 36 years, <b>Des Kennedy</b> and his family have lived largely outside their hand-built house in intimate contact with the Earth —&nbsp;its creatures, its changing seasons, and its weather patterns. In this charming book’s 52 chapters, Kennedy&nbsp;brings readers deep into his garden, week by week, from winter’s dormancy to summer’s splendor. With his&nbsp;trademark self-effacing humor, the author captures the essence of the gardening experience, exploring his triumphs, failures, mishaps, and occasional magic. Undaunted by setbacks and&nbsp;lusting for the perfect garden, Kennedy takes readers with him on a gardening journey rich with insights and adventures. The effects of devastating snow storms; the slow-food cuisine of rutabagas, parsnips, and carrots; the gardener's inalienable right to dress in rags; the outlandish behaviour and florid oratory induced by flowering poppies — these and scores of other topics meander through the book's gardening year alternately informing, inspiring, and amusing.<br>"
9781931236706,Face,"['Alexie, Sherman']","Formally adventurous, emotionally and musically rich, Charles North's poetry has received numerous honors, including two NEA grants and four Fund for Poetry Awards. In <i>Cadenza</i>, he displays all the qualities that made James Schuyler call him ""the most stimulating poet of his generation"" and the Washington Post hail him as ""one of the most memorable of contemporary poets."""
9781931082280,Reporting Civil Rights Vol. 1 (loa #137): American Journalism 1941-1963 (library Of America Classic Journalism Collection),['Clayborne Carson'],"From A. Philip Randolph's defiant call in 1941 for African Americans to march on Washington to Alice Walker in 1973, <i>Reporting Civil Rights</i> presents firsthand accounts of the revolutionary events that overthrew segregation in the United States. This two-volume anthology brings together for the first time nearly 200 newspaper and magazine reports and book excerpts, and features 151 writers, including James Baldwin, Robert Penn Warren, David Halberstam, Lillian Smith, Gordon Parks, Murray Kempton, Ted Poston, Claude Sitton, and Anne Moody. A newly researched chronology of the movement, a 32-page insert of rare journalist photographs, and original biographical profiles are included in each volume 
<p>Roi Ottley and Sterling Brown record African American anger during World War II; Carl Rowan examines school segregation; Dan Wakefield and William Bradford Huie describe Emmett Till's savage murder; and Ted Poston provides a fascinating early portrait of Martin Luther King, Jr. In the early 1960s, John Steinbeck witnesses the intense hatred of anti-integration protesters in New Orleans; Charlayne Hunter recounts the hostility she faced at the University of Georgia; Raymond Coffey records the determination of jailed children in Birmingham; Russell Baker and Michael Thelwell cover the March on Washington; John Hersey and Alice Lake witness fear and bravery in Mississippi, while James Baldwin and Norman Podhoretz explore northern race relations.</p>
<p>Singly or together, <i>Reporting Civil Rights</i> captures firsthand the impassioned struggle for freedom and equality that transformed America.</p>"
9781926920092,On The Road To Vegetarian Cooking,['Anne Lukin'],"From the author of The Big Carrot Vegetarian Cookbook. This book is for everyone: the beginner trying this style of cooking for the first time, the committed vegetarian who wants help with meal planning and is keen to try new culinary delights, and the ba"
9781933512082,How To Get A's In College,['Hundreds Of Heads'],"Getting in was only the beginning. You've got four years (maybe more) of college ahead, and you want to make the most of them. Everyone tells you that college is really different than high school, and they're right. Are you ready to succeed?
<p>You'll excel, with the support of the peers and classmates you'll meet in this book. Hundreds of successful college students and graduates share their wisdom, stories, tips, and advice on how to get high grades, choose the right major, manage your time, study smart, stay motivated, avoid stress, find the best teachers and courses, form important relationships, and graduate-happily-at the top of your class.</p>"
9781931993524,Horse Racing Coast To Coast: The Traveler's Guide To The Sport Of Kings (coast To Coast Series),"['Michael Walmsley', 'Marlene Smith-baranzini']","Go to the races with Horse Racing Coast to Coast, an exhilarating behind-the-scenes ride through the grandest racetracks across North America. You'll also learn the inside scoop on the best lodging, tastiest dining, and most intriguing sites nearby so you can transform a day at the races into a sightseeing adventure! Along the way, racing aficionados introduce you to champion Thoroughbreds, such as Funny Cide; fearless jockeys, including Bill ""The Shoe"" Shoemaker; and other horse racing greats."
9781909183162,Me And My Hair: A Social History,['Patricia Malcolmson'],"Good hair day? Bad hair day? Hair has always evoked strong emotions.<br>
<br>
In this fascinating book, Patricia Malcolmson examines how British women over the past 150 years have managed their hair, from the extravagant styles of the late nineteenth century to the ‘anything goes’ attitude of today, taking in along the way the daring bobs of the 1920s, the wartime styles of women in uniform, the slavish copying of Hollywood stars, the beehive, the hippy and the Goth. <br>
<br>
In Me and My Hair you’ll hear the voices of women from around Britain talking about their hair - whether it’s their longing to have ‘Shirley Temple’ curls, the visits of the nit nurse, their first home perm, roasting under hood dryers, going platinum blonde, hilarious experiments with hair extensions, or fears of going grey."
9781934157534,Rise Of An American Gangstress,['Kim K.'],"Good life to Hood life<br>

Born with a platinum spoon in her mouth thanks to her drug-dealing parents, Fancy is a young, spoiled princess. But when havoc enters the picture and the Feds seize her family's ill-gotten gains, Fancy's lavish Caribbean trips are traded in for cold winter nights in the heart of the hood. When the gravity of Fancy's situation causes her to crumble, it's her roots that put her back together. Unwilling to stay down, Fancy realizes that she was born to hustle, and this American Gangstress is reborn. What emerges is a fierce contender the streets aren't ready for."
9781931082679,George S. Kaufman & Co.: Broadway Comedies (loa #152): The Royal Family / Animal Crackers / June Moon / Once In A Lifetime / Of Thee I  Sing / You ... Stage Door / The Man Who (library Of America),['George S. Kaufman'],"Here, in the most comprehensive collection of George S. Kaufman's plays ever assembled, are nine classics: his ""backstage"" play The Royal Family (1927, written with Edna Ferber); the Marx Brothers-inspired mayhem of Animal Crackers (1928, with Morrie Ryskind), in a version discovered in Groucho Marx's papers and published here for the first time; June Moon (1929, with Ring Lardner), a hilarious look at a young composer trying to make it big on Tin Pan Alley; Once in a Lifetime (1930, with Moss Hart), one of the first and best satires of Hollywood; Pulitzer Prize winners Of Thee I Sing (1931, with Morrie Ryskind and Ira Gershwin) and You Can't Take It With You (1936, with Moss Hart); Dinner at Eight (1932, with Edna Ferber), a tart ensemble piece that mixes comedy and melodrama; Stage Door (1936, with Edna Ferber), his much-loved story about young actresses trying to make it big in New York City; and The Man Who Came to Dinner (1939, with Moss Hart), an unforgettable burlesque of America's cult of celebrity."
9781934706190,Simms Taback's Safari Animals,['Simms Taback'],"Here's a book that's also a guessing game! Turn the page for your first clue: ""I have a huge mane."" Open the flap and you'll see another: ""I can roar."" Open one more, and you'll see the answer to the riddle: ""It's a lion!"" In this colorful book of safari animals, the award-winning art of Simms Taback becomes a fun, interactive guessing game."
9781931499590,Time To Weave,"['Patrick, Jane.']","Highly textured objects such as plaited paper baskets, woven lanterns, small hearth rugs, and cork tables are featured&nbsp;in this beginner's guide to&nbsp;nonloom weaving.&nbsp;The&nbsp;easy instructions teach ancient techniques such as braiding, stringing, and knotting—and call for everyday materials such as copper tape, plastic sheeting,&nbsp;paper yarn, and granite tiles—to produce stunning contemporary designs for the home. A short essay about natural materials&nbsp;and the creative process introduces each&nbsp;project, and&nbsp;lovely&nbsp;photographs&nbsp;showcase&nbsp;the final results: sleek window hangings, stick-and-string coasters, pillows covered in canvas tape, and woven paper cards. A list of resources, an assortment of weaving tips, and suggestions for further reading are included."
9781931968119,"A Recent History Of The United States In Political Cartoons: A Look Bok (law, Politics, And Society)",['Chip Bok'],"History books are often sprinkled with editorial cartoons to illuminate the issues of a period of time. This is a history book of sorts, but with a twist. It is a view of the past twenty-five years through the eyes of an editorial cartoonist, with text used to illuminate the cartoons. It begins in Vietnam and waning years of the Nixon administration, the launching point of a thousand cartoon careers, and ends in the current war in Iraq. 
<p>This book looks at many issues, (the economy, military spending, race relations, religion, and culture) which have remained issues over the last 25 years and seven presidents, they simply increase and decrease over time.</p>
<p> One of the lessons drawn from this effort is that nothing ever gets resolved. All the big questions keep coming back in one form or another, making for an interesting reading.</p>"
9781929766628,"Brainjuice: American History, Fresh Squeezed!: Handprint Books",['Carol Diggory Shields'],"History homework getting you down? Too much to learn? Names? Dates? Important events? Hang in there! Help is on the way! Adroitly reducing reams of boring data about our nations past to a generous selection of over-the-top verses, Carol Diggory Shields presents our history with incisive hilarity. Here, for example, is her wry interpretation of the Louisiana Purchase: <br>
<i>Tom Jefferson went shopping for a city one fine day Something in the South with a harbor or a bay,<br>
 Voila! said the French, The city of your dreams!<br>
 For only 15 million, we will sell you New Orleans.</i> <br>
Nutritionally balanced, guaranteed pure, 100% refreshing, and cleverly distilled future BrainJuice topics will include biography, literature, and geography.

                        <p>A collection of poems on such important events in the history of the United States as the Pilgrims' landing in Massachusetts, the Louisiana Purchase, the Civil War, Seward's Folly, the San Francisco earthquake, and more.
</p>"
9781929242245,Puppy Intensive Care: A Breeder's Guide To Care Of Newborn Puppies,['Myra Savant-harris'],"If puppies are on the way, you want those newborns to have the best possible chance of survival and good health by being prepared. You can’t count on a vet being available, so breeders need to learn these skills. Learn how to administer simple but effective measures to help puppies in distress. Described in friendly, non-technical terms from a long-time breeder. BONUS! Comes with a 32 minute DVD to better illustrate the techniques recommended."
9781908117953,Vulcan Test Pilot: My Experiences In The Cockpit Of A Cold War Icon,['Tony Blackman'],"In 2007 a restored Avro Vulcan Mark 2 - XH558 - took to the skies to help commemorate the 25th anniversary of the Falklands conflict. To coincide with this the memoirs of one of its test pilots, Tony Blackman, was published to great acclaim. Now the first book about test flying this monumental delta-wing aircraft which dominated the history of the late 20th century is available in paperback. <br>
<br>
Tony is the ideal man to write such a tale as he flew no less than 105 of the 136 built, logging 850 flights at over 1,327 hours. His book describes in layman's terms what it was like to tame the first prototypes and to master the unusual characteristics necessitated by the Vulcan's shape. <br>
<br>
Although Tony puts the developments, demonstrations, incidents and accidents in their political and historical context, his story is a highly personal one. He explains how this awesome aircraft became a national treasure and captured the imagination of the whole country. His words, descriptions and hitherto largely unpublished photographs will make people feel as he did the excitement of handling such an incredibly powerful monster always in the knowledge that he had to be in complete charge all the time as the monster could and did bite back."
9781931520133,Mothers And Other Monsters: Stories,"['Mchugh, Maureen F.']","In her debut collection, Maureen F. McHugh examines the impacts of social and technological shifts on families. Using deceptively simple prose, she illuminates the relationship between parents and children and the expected and unexpected chasms that open between generations."
9781933859217,Ironies Of Faith: The Laughter At The Heart Of Christian Literature,"['Esolen, Anthony M.']","In Ironies of Faith, celebrated Dante scholar and translator Anthony Esolen provides a profound meditation upon the use and place of irony in Christian art and in the Christian life. Esolen explores the ironies of time (for Christians believe in divine Providence, but live in a world whose moments pass away); the ironies of power (for Christians believe in an almighty God who took on human flesh, and whose ""weakness"" is stronger than death); the ironies of love (for man seldom knows whom to love, or how, or even whom it is that in the depths of his heart he loves best); and the figure of the Child (for Christians believe that unless we become like unto one of these little ones, we shall not enter the Kingdom of God).
<p>This finely wrought study draws from Augustine, Dante, Shakespeare, Tolkien, Mauriac, Milton, Herbert, Hopkins, Dickens, and Dostoyevsky, among others, including the anonymous author of the medieval poem Pearl. Such authors, Anthony Esolen believes, teach us that the last laugh is on the world, because that grim old world, taking itself so seriously that even its laughter is a sneer, will finally-despite its proud resistance-be redeemed. That is the ultimate irony of faith.</p>"
9781931082006,Dashiell Hammett: Crime Stories And Other Writings (library Of America),['Dashiell Hammett'],"In the stories and novellas he wrote for Black Mask and other pulp magazines in the 1920s and 1930s, Dashiell Hammett took the detective story and turned it into a medium for capturing the jarring textures and revved-up cadences of modern American life. In this volume, The Library of America collects the finest of these stories: 24 in all, along with some revealing essays and an earlier version of his novel The Thin Man.
<p>Mixing melodramatic panache and poker-faced comedy, a sensitivity to place and a perceptive grasp of social conflict, Hammett's stories are hard-edged entertainments for an era of headlong change and extravagant violence. For the heroic sagas of earlier eras Hammett substituted the up-tempo, devious, sometimes nearly nihilistic exploits of con men and blackmailers, fake spiritualists and thieving politicians, slumming socialites and deadpan assassins.</p>
<p>As a guide through this underworld he created the Continental Op, the nameless, laconic detective, world-weary and unblinking, who serves as protagonist of most of these stories. The deliberately unheroic Op is separated only by his code of professionalism from the brutality and corruption that run rampant in stories such as ""Zigzags of Treachery,"" ""Dead Yellow Women,"" ""Fly Paper,"" and ""$106,000 Blood Money.""</p>
<p> Hammett's years of experience as a Pinkerton detective give even his most outlandishly plotted mysteries a gritty credibility, and his intimate knowledge of San Francisco made him the perfect chronicler of that city's waterfronts, back alleys, police stations, and luxury hotels. By connecting crime fiction to the realities of American streets and American speech, his Black Mask stories opened up new vistas for generations of writers and readers.</p>"
