isbn,title,authors,overview
9781932841435,Before I Forget,"['Pitts, Leonard.']","""A man recently diagnosed with early-onset Alzheimer's disease takes a road trip to visit his ailing, estranged father, along with his troubled teen-aged son""--Provided by publisher."
9781935001126,Born Amish,"['Ruth Irene Garrett', 'Deborah Morse-kahn']","""But what was your life like before?"" 
<p>This is the question that RUTH IRENE GARRETT, nee Miller, has been asked again and again by the thousands of inspired and fascinated guests who have attended her lectures and programs on her life growing up Amish to young womanhood, when she fell in love with an ""Englisher"" and left the Amish community to begin her new life out in the world.</p>
<p>Now, working with co-author and friend DEBORAH MORSE-KAHN, we learn about Ruth Irene Garrett's early life as a child growing up in the Amish farming community of Kalona, Iowa: school, games, and chores; work, crafts, and foods; clothing, farming and tumbling about with many brothers and sisters. We learn about the expectations for girls and boys in Amish families, of social roles and understandings about courtship and marriage, about adult baptism and a life of faith in the Amish Church.</p>
<p> <i>Born Amish</i> is richly illustrated with wonderful color photographs of young people and families in Amish life throughout the American Midwest.</p>"
9781926760681,I Wrote This For You,"['Pleasefindthis', 'Iain S. Thomas']","""I need you to understand something. I wrote this for you. I wrote this for you and only you. Everyone else who reads it, doesn't get it."" 
<p>Started 2007, I Wrote This For You is an acclaimed exploration of hauntingly beautiful words, photography and emotion that's unique to each person that reads it. This book gathers together nearly 200 of the most beautiful entries into four distinct chapters; Sun, Moon, Stars, Rain. Together with several new and exclusive entries that don't appear anywhere else, each chapter of I Wrote This For You focuses on a different facet of life, love, loss, beginnings and endings.</p>"
9781934206812,The Gnostic Bible: The Pistis Sophia Unveiled,['Samael Aun Weor'],"""It came to pass, when Jesus had risen from the dead, that he passed eleven years discoursing with his disciples, and instructing them..."" (The Pistis Sophia) 
<p>The Apostles wrote down what Jesus taught them during those eleven years, resulting in ""The Pistis Sophia,"" the most important Gnostic scripture. Includes an extensive commentary by Samael Aun Weor. ""The Pistis Sophia"" is a sophisticated and deeply mystical teaching given by Jesus about the suffering of Sophia as she attempts to ascend to the highest spiritual truth. This scripture is remarkable for its profound mysticism, its clear rebuke of unethical behavior, and its perspective on the spiritual role of women. Having read this text, it becomes very clear why the established religious powers attempted to obliterate the Gnostics, but failed. Study of this teaching also inspires a re-evaluation of how the Christian Gospels have been interpreted for centuries.</p>
<p>About this scripture, the commentary author Samael Aun Weor said, """"The Hebrew Bible clearly connotes the Word of the Eternal One. However, we, the Gnostics, also have our very special Bible. I want to emphatically declare that this is The Pistis Sophia, whose original is in Coptic. It was found underground in Egypt, the land of the Pharaohs. The Pistis Sophia contains all the words of the adorable Savior of the world. It was written by the Apostles. Thus, all the Esoteric-Christic instructions that Jesus Christ gave to his disciples on the Mount of the Olives and other holy places is written within this book. This book had been conserved in secret for many centuries. In this book, the Adorable One left an extraordinary, formidable body of doctrine.""</p>"
9781932100884,The Psychology Of Harry Potter: An Unauthorized Examination Of The Boy Who Lived,['Neil Mulholland'],"** COMPLETELY UNAUTHORIZED **&nbsp;Leading psychologists delve into the world and characters of Harry Potter in this revealing look at J. K. Rowling's constructed universe, using the characters and their puzzling situations to offer insight into real-world psychology. Designed to appeal to both fans of pop culture and students of psychology, this unique blend of scholarship and contemporary criticism consists of essays by professional psychologists hailing from schools and clinical practices throughout the world. Every major area of psychology is covered as the contributors tackle such heady questions as <i>Is Harry a cranky adolescent or suffering from real post-traumatic-stress disorder?</i> <i>Is Voldemort evil incarnate or a misguided boy now twisted beyond recognition?</i> and <i>Is Snape treacherous or struggling for redemption?,</i> revealing the fictional world's complex psychological brew.<br>"
9781932100082,Seven Seasons Of Buffy: Science Fiction And Fantasy Writers Discuss Their Favorite Television Show (smart Pop Series),['Glenn Yeffeth'],"** COMPLETELY UNAUTHORIZED **&nbsp;This collection of irreverent and surprising essays about the popular television series <i>Buffy the Vampire Slayer</i> includes pieces by leading science fiction and fantasy authors. Contributors include bestselling legend David Brin, critically acclaimed novelist Scott Westerfield, cult-favorite vampire author Chelsea Quinn Yarbro, and award-winner Sarah Zettel. The show and its cast are the topics of such critical pieces as Lawrence Watt-Evans's “Matchmaking in Hellmouth” and Sherrilyn Kenyon's “The Search for Spike's Balls.” An informed introduction for those not well acquainted with the show, and a source of further research for Buffy buffs, this book raises interesting questions concerning a much-loved program and future cult classic.<br>"
9781908402691,Bradshaw's Continental Railway Guide (abridged Version),['George Bradshaw'],"*This electronic edition is an abridged version of the original 1548pp book. All the original text is included, along with a wealth of carefully selected examples from the several hundred pages of timetables and advertisements.* <br>
 Following its bestselling edition of Bradshaw’s Handbook 1863, Old House brings you this fascinating guide to Europe’s rail network on the very brink of the First World War.&nbsp; Published in 1913, it is divided into three sections: timetables for services covering the continent, short guides to each city and notable destination and features, and a wealth of advertisements and ephemeral materials concerning hotels, restaurants and services that might be required by the early twentieth century traveller by rail. It affords a fascinating glimpse of fin de siècle Europe and of a transport network that was shortly to be devastated by the greatest war the world had ever seen."
9781933027937,Vogue® Knitting Stitchionary® Volume Five: Lace Knitting: The Ultimate Stitch Dictionary From The Editors Of Vogue® Knitting Magazine (vogue Knitting Stitchionary Series),['Editors Of Vogue Knitting Magazine'],"<b><i>The newest volume in Vogue Knitting’s must-have series!</i></b> 
<p>Lovely, versatile lace comes in infinite varieties—light and airy, chunky, intricate—and is perennially popular with knitters. Featuring clear, concise instructions, charts, and gorgeous color photographs of over 150 designs, this fifth installment in the successful <i>Stitchionary</i> series provides a complete catalog of lace patterns from the <i>Vogue Knitting</i> archives.</p>
<p>This is sure to be an essential reference for every knitter’s library.</p>
<p class=""null1""><i>Stitchionary #5</i> includes:</p>
<p>- Easy mesh patterns: straightforward and perfect for first-time lace knitters</p>
<p>- Allover patterns: range from small and simple to fairly complex and challenging</p>
<p>- Combinations: lace teams up with cables, embroidery and more</p>
<p>- Edgings: helps knitters find the perfect finishing touch for any garment.</p>
<p>- Motifs: an excellent starting point for a design</p>
<p>- Panels can stand alone or team up with other patterns to create stunning effects</p>
<p>- Chevrons: add movement and visual interest with their undulating rhythms.</p>"
9781931543781,Vogue Knitting on the Go! Crocheted Hats,['Trisha Malcolm'],"<b><i>VogueÂ® Knitting</i> goes wild for hats--and crocheters will too, with this new volume in the wildly popular take-it-with-you series.</b><p>Even novices can get in on the hatmaking fun, because these chic headgear patterns use only the most basic crochet techniques--and go forward one skill at a time. Yet the finished items look as good as something bought from a stylish boutique. A saucy brimmed hat, with a black yarn ribbon and bow trim, is positively adorable. The attractive striped helmet takes its inspiration from Peruvian colors, and has a flap to keep ears toasty warm. Liven up any outfit with a whimsical square cap in an array of pinks. From the sophisticated to the zany, the traditional to the unique, there's a style for everyone.</p>"
9781907967054,I'm Not Ready! (baby Owl),['Jonathan Allen'],"<b>The time comes for every baby bird to fly from its nest…but Baby Owl's not ready.</b> 
<p>It's the first day of preschool, and Mama's in a hurry: ""<i>Please, Baby Owl</i>, we have to go!"" But Baby Owl will do almost ANYTHING to stay at home--even put his toys away! Can Mama convince Baby Owl that school will be fun?</p>
<p>Jonathan Allen has created a comforting and cozy story, filled with his characteristic wit, appealing art, and delightful surprises.</p>"
9781933392745,Composting: An Easy Household Guide (chelsea Green Guides),['Nicky Scott'],"<br>
<b>COMPOSTING: AN EASY HOUSEHOLD GUIDE THE CHELSEA GREEN GUIDES--A NEW SERIES OF POCKET-SIZED BOOKS TO HELP SAVE THE EARTH!</b><br>
Did you know that up to two-thirds of most household trash can be composted? That composting reduces the need for more landfills? Composting is fun and easy! And you can make compost even if you live in an apartment and don't have access to a garden. This book provides all the information you need for successful composting--a satisfying way to live lightly on Earth. Also available:<br>
<b>WATER: USE LESS--SAVE MORE ENERGY: USE LESS--SAVE MORE REDUCE, REUSE, RECYCLE: AN EASY HOUSEHOLD GUIDE</b>"
9781931498791,"Edible Forest Gardens, Vol. 1: Ecological Vision And Theory For Temperate Climate Permaculture","['Dave Jacke', 'Eric Toensmeier']","<br>
<i>Edible Forest Gardens</i> is a groundbreaking two-volume work that spells out and explores the key concepts of forest ecology and applies them to the needs of natural gardeners in temperate climates. Volume I lays out the vision of the forest garden and explains the basic ecological principles that make it work. In Volume II, Dave Jacke and Eric Toensmeier move on to practical considerations:concrete ways to design, establish, and maintain your own forest garden. Along the way they present case studies and examples, as well as tables, illustrations, and a uniquely valuable ""plant matrix"" that lists hundreds of the best edible and useful species.<br>
Taken together, the two volumes of <i>Edible Forest Gardens</i> offer an advanced course in ecological gardening--one that will forever change the way you look at plants and your environment."
9781933392899,Renewing America's Food Traditions: Saving And Savoring The Continent's Most Endangered Foods,['Gary Paul Nabhan'],"<br>
<i>Renewing America's Food Traditions</i> is a beautifully illustrated dramatic call to recognize, celebrate, and conserve the great diversity of foods that gives North America its distinctive culinary identity that reflects our multicultural heritage. It offers us rich natural and cultural histories as well as recipes and folk traditions associated with the rarest food plants and animals in North America. In doing so, it reminds us that what we choose to eat can either conserve or deplete the cornucopia of our continent.
<p>While offering a eulogy to a once-common game food that has gone extinct--the passenger pigeon--the book doesn't dwell on tragic losses. Instead, it highlights the success stories of food recovery, habitat restoration, and market revitalization that chefs, farmers, ranchers, fishermen, and foresters have recently achieved. Through such ""food parables,"" editor Gary Paul Nabhan and his colleagues build a persuasive argument for eater-based conservation.</p>
<p>In addition, this book offers the first-ever list of foods at risk in America (more than a thousand), shows how all of us can personally support and participate in such recoveries, and lists food festivals held across the continent to honor and enjoy some of the country's most iconic foods, from crab cakes to maple syrup and filé gumbo. Organized by ""food nations"" named for the ecological and cultural keystone foods of each region--Salmon Nation, Bison Nation, Chile Pepper Nation, among others--this book offers an altogether fresh perspective on the culinary traditions of North America.</p>"
9781933392370,The Rammed Earth House,['David Easton'],"<br>
<i>The Rammed Earth House</i> is an eye-opening example of how the most dramatic innovations in home design and construction frequently have their origins in the distant past. By rediscovering the most ancient of all building materials —earth—forward-thinking homebuilders can now create structures that set new standards for beauty, durability, and efficient use of natural resources.
<p>Rammed earth construction is a step forward into a sustainable future, when homes will combine pleasing aesthetics and intense practicality with a powerful sense of place. Rammed earth homes are built entirely on-site, using basic elements—earth, water, and a little cement. The solid masonry walls permit design flexibility while providing year-round comfort and minimal use of energy. The builder and resident of a rammed earth house will experience the deep satisfaction of creating permanence in a world dominated by the disposable.</p>"
9781933392110,The Revolution Will Not Be Microwaved: Inside America's Underground Food Movements,['Sandor Ellix Katz'],"<br>
An instant classic for a new generation of monkey-wrenching food activists. Food in America is cheap and abundant, yet the vast majority of it is diminished in terms of flavor and nutrition, anonymous and mysterious after being shipped thousands of miles and passing through inscrutable supply chains, and controlled by multinational corporations. In our system of globalized food commodities, convenience replaces quality and a connection to the source of our food. Most of us know almost nothing about how our food is grown or produced, where it comes from, and what health value it really has. It is food as pure corporate commodity. We all deserve much better than that. 
<p>In <i>The Revolution Will Not Be Microwaved</i>, author Sandor Ellix Katz (<i>Wild Fermentation</i>, Chelsea Green 2003) profiles grassroots activists who are taking on Big Food, creating meaningful alternatives, and challenging the way many Americans think about food. From community-supported local farmers, community gardeners, and seed saving activists, to underground distribution networks of contraband foods and food resources rescued from the waste stream, this book shows how ordinary people can resist the dominant system, revive community-based food production, and take direct responsibility for their own health and nutrition.</p>"
9781933693965,Which Side Are You On?: The Story Of A Song,['George Ella Lyon'],"<br>
Come all you poor workers Good news to you I’ll tell Of how the good old union Has come in here to dwell.
<p>Which side are you on?<br>
Which side are you on?<br>
</p>"
9781931498579,The Culture Of Make Believe,['Derrick Jensen'],"<br>
Derrick Jensen takes no prisoners in <i>The Culture of Make Believe</i>, his brilliant and eagerly awaited follow-up to his powerful and lyrical <i>A Language Older Than Words</i>. What begins as an exploration of the lines of thought and experience that run between the massive lynchings in early twentieth-century America to today's death squads in South America soon explodes into an examination of the very heart of our civilization. <i>The Culture of Make Believe</i> is a book that is as impeccably researched as it is moving, with conclusions as far-reaching as they are shocking."
9781931499897,Knit Kimono,['Vicki Square'],"<br>
From casual to formal, the kimono shape has endured for centuries as an internationally recognized icon of Japanese life and culture. With 18 original designs, each a knitted interpretation of a traditional kimono style, this handbook makes knitting homemade kimonos deceptively easy. Projects are based on rectangular forms that require very little shaping, and are ideal first-garment projects for knitters wanting to venture beyond scarves. Clever details in stitch patterns and edgings, such as the use of&nbsp;silk, linen, and bamboo yarns, add sophistication and elegance to even the simplest designs. The flattering drape and luxurious style of the kimono will appeal to veteran and beginning knitters alike.&nbsp; <br>"
9781931498647,Guantanamo: What The World Should Know,"['Michael Ratner', 'Ellen Ray', 'Anthony Lewis']","<br>
In the months following its initial release, <i>Guant¡namo: What the World Should Know</i> has proved to be a disturbingly accurate account of the Bush administration's tangle with civil liberties and torture. Written by Michael Ratner (Center for Constitutional Rights President and co-consul on the case of Rasul v. Bush)and Ellen Ray (Institute for Media Analysis President), <i>Guantanamo</i> is the most authoritative documentation to date on President Bush's moves toward a network of detention centers--a system without accountability, which flouts U.S. and international law.<br>
With a resource section that includes the Gonzales memo to President Bush and excerpts from the Geneva Conventions, <i>Guantanamo</i> provides strong evidence of Ratner explains how Gonzales and the Bush Administration are acting to radically alter America's historic commitment to civil and human rights, and why all Americans should resist what is being done in our name.<br>
Gathered together for the first time, <i>Guant¡namo: What the World Should Know</i> includes the governmental memorandum that led to the conditions at the Naval Station at Guantanamo Bay, Abu Ghraib and beyond.<br>
Ratner and Ray give the definitive account of what led to the current conditions at Guant¡namo and the importance of continuing to fight against the violations of U.S. and international law undertaken by the United States since 9-11. This book is a must-read for anyone concerned with the rule of law, liberty, democracy--and the right to dissent."
9781933392127,The Citizen-powered Energy Handbook: Community Solutions To A Global Crisis,"['Pahl, Greg.']","<br>
In the wake of Hurricane Katrina, Al Gore's summer blockbuster <i>An Inconvenient Truth</i>, and crude oil prices soaring to all-time highs, more people than ever know the truth about our oil addiction. Global warming is here. M. King Hubbert's oil peak is fast approaching (or may already have arrived). The secret's out: fossil fuel reserves are dwindling and popular interest has created the need for accessible, realistic solutions. <em>The Citizen-Powered Energy Handbook</em>, a clear-eyed view of the critical situation we face, offers ways out. Greg Pahl examines energy technologies currently available and homes in on renewable energy strategies that can be adopted by individuals and communities. Such cooperative initiatives have been common in Europe for years and are beginning to gain a foothold in the US. Each chapter focuses on a different renewable energy category--solar, wind, water, biomass, liquid biofuels, and geothermal--then reviews their advantages and disadvantages and desccribes numerous examples of successful, proven local initiatives. <em>The Citizen-Powered Energy Handbook</em> is an eloquent appeal for community and regional action to initiate an array of solutions to energy needs until now controlled by large, distant utilities and consortiums. It is time to take back control of the energy and environmental challenges ahead; this book will help people do just that. It is a handbook for anyone ready to take the first steps towards a more sustainable future."
9781933392134,The Holistic Orchard: Tree Fruits And Berries The Biological Way,['Michael Phillips'],"<br>
Many people want to grow fruit on a small scale but lack the insight to be successful orchardists. Growing tree fruits and berries is something virtually anyone with space and passionate desire can do - given wise guidance and a personal commitment to observe the teachings of the trees. A holistic grower knows that producing fruit is not about manipulating nature but more importantly, fostering nature. Orcharding then becomes a fascinating adventure sure to provide your family with all sorts of mouth-watering fruit.
<p><i>The Holistic Orchard</i> demystifies the basic skills everybody should know about the inner-workings of the orchard ecosystem, as well as orchard design, soil biology, and organic health management. Detailed insights on grafting, planting, pruning, and choosing the right varieties for your climate are also included, along with a step-by-step instructional calendar to guide growers through the entire orchard year. The extensive profiles of pome fruits (apples, pears, asian pears, quinces), stone fruits (cherries, peaches, nectarines, apricots, plums), and berries (raspberries, blackberries, blueberries, gooseberries, currants, and elderberries) will quickly have you savoring the prospects.</p>
<p>Phillips completely changed the conversation about healthy orcharding with his first bestselling book, <i>The Apple Grower</i>, and now he takes that dialogue even further, drawing connections between home orcharding and permaculture; the importance of native pollinators; the world of understory plantings with shade-tolerant berry bushes and other insectary plants; detailed information on cover crops and biodiversity; and the newest research on safe, homegrown solutions to pest and disease challenges.</p>
<p>All along the way, Phillips' expertise and enthusiasm for healthy growing shines through, as does his ability to put the usual horticultural facts into an integrated ecology perspective. This book will inspire beginners as well as provide deeper answers for experienced fruit growers looking for scientific organic approaches. Exciting times lie ahead for those who now have every reason in the world to confidently plant that very first fruit tree!</p>"
9781931498401,"Perennial Vegetables: From Artichoke To Zuiki Taro, A Gardener's Guide To Over 100 Delicious, Easy-to-grow Edibles",['Eric Toensmeier'],"<br>
There is a fantastic array of vegetables you can grow in your garden, and not all of them are annuals. In <i>Perennial Vegetables</i> the adventurous gardener will find information, tips, and sound advice on less common edibles that will make any garden a perpetual, low-maintenance source of food.
<p>Imagine growing vegetables that require just about the same amount of care as the flowers in your perennial beds and borders—no annual tilling and potting and planting. They thrive and produce abundant and nutritious crops throughout the season. It sounds too good to be true, but in <i>Perennial Vegetables</i> author and plant specialist Eric Toensmeier (<i>Edible Forest Gardens</i>) introduces gardeners to a world of little-known and wholly underappreciated plants. Ranging beyond the usual suspects (asparagus, rhubarb, and artichoke) to include such ""minor"" crops as ground cherry and ramps (both of which have found their way onto exclusive restaurant menus) and the much sought after, anti-oxidant-rich wolfberry (also known as goji berries), Toensmeier explains how to raise, tend, harvest, and cook with plants that yield great crops and satisfaction.</p>
<p>Perennial vegetables are perfect as part of an edible landscape plan or permaculture garden. Profiling more than 100 species, illustrated with dozens of color photographs and illustrations, and filled with valuable growing tips, recipes, and resources, <i>Perennial Vegetables</i> is a groundbreaking and ground-healing book that will open the eyes of gardeners everywhere to the exciting world of edible perennials.</p>"
9781931498777,American Farmstead Cheese: The Complete Guide To Making And Selling Artisan Cheeses,"['Paul Kindstedt', 'Vermont Cheese Council']","<br>
This comprehensive guide to farmstead cheese explains the diversity of cheeses in terms of historical animal husbandry, pastures, climate, preservation, and transport-all of which still contribute to the uniqueness of farm cheeses today. Discover the composition of milk (and its seasonal variations), starter cultures, and the chemistry of cheese. The book includes:<br>
<ul class=""noindent"">
<li>A fully illustrated guide to basic cheesemaking</li>
<li>Discussions on the effects of calcium, pH, salt, and moisture on the process</li>
<li>Ways to ensure safety and quality through sampling and risk reduction</li>
<li>Methods for analyzing the resulting composition</li>
<li class=""null1""><br>
... The Vermont Cheese Council is a nonprofit organization whose support of more than dozen Vermont cheesemakers contributes to a vision for continued agricultural practices and the preservation of Vermont's rural landscape. For those who want to quit their boring jobs and do something that will make their lives meaningful, here's the book. Paul Kindstedt must be considered an American treasure. Of all the books in my possession, this one is now the most important.</li>
</ul>"
