isbn,title,authors,overview
9781931382434,Zinn's Cycling Primer: Maintenance Tips And Skill Building For Cyclists,['Lennard Zinn'],"<p>A complete guide to the sport and pastime, Zinn's Maintenance Tips and Skill Building for Cyclists is for the novice and aficionado alike. The book includes routine bicycle maintenance tips, simple tricks to fix troublesome quirks, and tutorials to help increase cycling performance. The focus is on both learnable skills and understanding components and hardware. Specific units range from improving pedal stroke and building a disc brake rear wheel to setting up clip-in pedals and shoes and mastering technical uphills. Famous athletes and mechanics provide special insight, and accompanying photographs clearly illustrate each procedure. Aimed at road and mountain cyclists as well as triathletes, this book presents valuable information in a format that's fun and easy to grasp.</p>"
9781934184073,"Voices Of Bipolar Disorder: The Healing Companion: Stories For Courage, Comfort And Strength (voices Of Series)",['Judtih Cohen'],"<p>A Devastating Mental Illness that Affects Six Million People in the United States. Bipolar Disorder is Marked by Extreme Swings in Mood. From Uncontrollable, Euphoric Mania to Unimaginable Depression that can Make Life Almost Intolerable, Not Only For those Suffering with the Illness But For their Families. Friends and Caregivers as Well.</p>
<p>Reflecting on his Teenage Suicide Attempt. A Young Man Still Struggling with Bipolar Disorder Realizes How Much Becoming a Father Has Changed Him.</p>
<p>A Mother is Wracked with Guilt When She Commits Her Young Son to a Psychiatric Hospital-The Only Place She Knows He'll Get the Care he Needs.</p>
<p>Often Bipolar Disorder is a Family Affair. One Young Woman Whose Sister and Mother are also Bipolar Calls it ""The Disorder of Being Too Human.""</p>
<p>A Husband Reminds His Wife. She is Not Bipolar. She Has Bipolar. The Disease Does Not Define Her.</p>
<p>The latest volume in the acclaimed Voices Of book series, the reader is taken inside this challenging illness through dozens of true stories written by those with the disorder and by those whose lives have been touched by the disease. Sometime shocking, often inspiring and always revealing. Voices of Bipolar Disorder includes a medical overview by Dr. Maria Benaur, a renowned specialist in the research and treatment of bipolar disorder, a round-table interview with the creators and cast of the Tony award-winning Broadway musical Next to Normal that has brought bipolar disorder to the national stage, and a comprehensive resources section for those seeking help. Voices of Bipolar Disorder reminds the world of the strength of the human spirit in the face of nearly unimaginable adversity.</p>"
9781934670378,"Explore Colonial America!: 25 Great Projects, Activities, Experiments (explore Your World)","['Fisher', 'Verna']","<p>A hands-on history of America’s early settlers and their brave journey, this kid-focused approach to learning answers to&nbsp;questions such as <i>What were colonial houses like?</i> <i>What did the colonists eat?</i> and <i>Was there really a Thanksgiving feast between Native Americans and the Pilgrims?</i> Twenty-five engaging activities pack the pages, allowing children to build, play, discover, experiment, bake, and eat like the colonials did. With such projects introduced alongside cool facts, fun illustrations, and in-depth historical information, kids will learn without even realizing it as they are guided through the Colonial era.</p>"
9781926851068,In The Mean Time,"['Tremblay, Paul']","<p>A history teacher begins his unorthodox senior course with clips from an ominous surveillance video, causing a student's home life to deteriorate along with the lessons. A girl with a second head that changes into different historical and fictional identities tries to find her father while figuring out how to handle Mom and the book club. A blog documents society's slow, unexplained but inexorable end, or is it only a collection of pixel-sized paranoia? A once-awkward teen holes up in a kiddie-themed amusement part after the end of the world, and schemes to take Cinderella's Castle by force.</p>"
9781933027845,Vogue® Knitting Shawls & Wraps,['Editors Of Vogue Knitting Magazine'],"<p>A shawl can keep you warm in the winter, top off an elegant evening dress, or chase away the chill on a summer evening. It’s the perfect addition to any wardrobe—and the perfect project for any knitter who’s tired of working on scarf after scarf and wants to move on to something new. <i>Vogue Knitting Shawls &amp; Wraps</i> presents 25 of the magazine’s most gorgeous wraps, all created by today’s top knitwear designers. The patterns include a chic beaded shawl or one with delicate open lacework; a cozy cabled cape, a stylish fringed wrap, and many other exquisite designs.</p>"
9781932531558,Six Sigma For Small Business,['Greg Brue'],"<p>A Six Sigma pioneer from Jack Welch’s original team at GE shows you how to bring big improvements to your small business</p>
<p><i>Six Sigma for Small Business</i> is the first book to apply six sigma to the unique challenges of a small business. It shows how to use the methodology in all aspects of business to identify and fix problems, with chapters on: accounting, finance, sales and marketing, purchasing a business, human resources, and developing new products. It walks you through a step-by-step implementation of six sigma, describing how to identify needs, develop metrics, and set objectives. It also provides real-life examples of small-business six sigma success stories.</p>"
9781908170989,Living With Less: How To Downsize To 100 Personal Possessions,['Mary Lambert'],"<p>A unique programme to help you reduce your personal possessions to 100 items. Many people think that the more they own, the more contented and happy they will be - their lives become defined by their possessions. In fact, the opposite is often true: the more we have, the less happy and contented we are in mind, body and spirit. In Living with Less, decluttering expert Mary Lambert sets you the challenge of reducing your personal possessions to just 100 items. In Part 1 Mary describes how keeping too many possessions affects you - clutter can stop you moving forward in life and learning how to release some of your possessions can be liberating and fulfilling. In Part 2, you begin the 100-item challenge, starting with an inventory of your personal possessions. Then you begin the easy-to-follow goalsetting programme to start the process of clearing out your items: broken down into manageable categories, you address each area of your possessions at a time, from clothes to jewellery to hobby items. Mary does of course practise what she preaches: you can follow her own 100-item challenge throughout the book. And, once you've addressed your personal items, you may want to tackle the rest of your household goods.</p>"
9781908323125,A Woman In The Crossfire: Diaries Of The Syrian Revolution,['Samar Yazbek'],"<p>A well-known novelist and journalist from the coastal city of Jableh, Samar Yazbek witnessed in person and actively participated in the first four months of the Syrian <i>intifada</i>. Throughout she kept a diary of personal reflections. Her outspoken views published in print, online, and on Facebook quickly attracted the attention and fury of the regime, as vicious rumors spread about her disloyalty to the homeland and the Alawite community from which she comes. This narrative weaves together her struggle to protect herself and her young daughter after she is forced to leave her home and live on the run, detained multiple times, and eventually flees to Europe.</p>
<p>Filled with exhilarating hope and horrifying atrocities, <i>A Woman in the Crossfire</i> offers us a wholly unique perspective on the Syrian uprising. Yazbek's is a modest yet powerful testament to the strength and commitment of countless unnamed Syrians who dream of bringing an end to a forty-year-old dictatorship. Their fight for their dignity will inspire all those who read this book and challenge the world to look anew at the trials and tribulations of the Syrian uprising.</p>
<p><b>Samar Yazbek</b> has published several novels and collections of short stories, the most recent of which is <i>In Her Mirrors</i>. An excerpt of her novel <i>Cinnamon</i> was published in the anthology <i>Beirut 39</i> (Bloomsbury, 2010) and will be published by Haus in 2013.</p>"
9781934137543,Cage,"['Weiss, Gordon.', 'Tamil̲īl̲a Viṭutalaippulikaḷ (association)']","<p>“An excellent account . . . scrupulously fair.”—<i><b>Economist</b></i></p>
<p>“This powerful book is a haunting reminder of the price countries in the developing world pay for the flawed choices of their founders.” —<i><b>Wall Street Journal</b></i></p>
<p>“<i>The Cage</i> is a tightly-written and clear-eyed narrative about one of the most disturbing human dramas of recent years. . . . a riveting, cautionary tale about the consequences of unchecked political power in a country at war. A must-read.” —<b>JON LEE ANDERSON</b>, <i>New Yorker</i> staff writer and author of <i>The Fall of Baghdad</i></p>
<p>“This shattering, heartbreaking tale of savagery and suffering not only lifts the veil that conceals one of the most awful tragedies of the current era, but also helps us understand what should be done, not just in this sad and beautiful land, but long before other such horrors spiral out of control.” —<b>NOAM CHOMSKY</b>, Institute Professor &amp; Professor of Linguistics, MIT, and author of <i>Hopes and Prospects</i></p>
<p>In the closing days of the thirty-year Sri Lankan civil war, tens of thousands of civilians were killed, according to UN estimates, as government forces hemmed in the last remaining Tamil Tiger rebels on a tiny sand spit, dubbed “The Cage.” Gordon Weiss, a journalist and UN spokesperson in Sri Lanka during the final years of the war, pulls back the curtain of government misinformation to tell the full story for the first time. Tracing the role of foreign influence as it converged with a history of radical Buddhism and ethnic conflict, <i>The Cage</i> is a harrowing portrait of an island paradise torn apart by war and the root causes and catastrophic consequences of a revolutionary uprising caught in the crossfire of international power jockeying.</p>
<p><b>Gordon Weiss</b> has lived in New York and worked in numerous conflict and natural disaster zones including Bosnia, Afghanistan, Darfur, and Haiti. Employed by the United Nations for over twelve years, he is now a visiting scholar at Sydney University and a correspondent for Australia’s <i>Global Mail,</i> where he continues his investigative reporting on Sri Lanka.</p>"
9781934137109,Pale Faces: The Masks Of Anemia (bellevue Literary Press Pathographies),"['Bardes', 'Charles L.']","<p>“Charles Bardes’ meditations on medicine . . . are beautifully—transparently—written, deeply informed . . . and they carry surprise.”—Sven Birkerts, author of <i>Reading Life</i> and <i>The Gutenberg Elegies</i></p>
<p>Whether mild or deadly, anemia affects an essential body fluid: blood. Probing deeply into this illness as metaphor, Charles L. Bardes explores the impact of both science and culture on its treatment across the ages. His innovative “life” of this condition ranges widely through history, art, literature, and clinical practice to examine how the way doctors think influences the practice of medicine.</p>"
9781931520089,Carmen Dog (peapod Classics),"['Emshwiller', 'Carol']","<p>“Combines the cruel humor of <i>Candide</i> with the allegorical panache of <i>Animal Farm.</i>”—<i>Entertainment Weekly</i></p>
<p>""Carol is the most unappreciated great writer we've got. <i>Carmen Dog</i> ought to be a classic in the colleges by now . . . It's so funny, and it's so keen.""<br>
—Ursula K. Le Guin</p>
<p>“A rollicking outre satire.... full of comic leaps and absurdist genius.”—<i>Bitch</i></p>
<p>“A wise and funny book.”—<i>The New York Times</i></p>
<p>""This trenchant feminist fantasy-satire mixes elements of <i>Animal Farm, Rhinoceros</i> and <i>The Handmaid's Tale</i>.... Imagination and absurdist humor mark [<i>Carmen Dog</i>] throughout, and Emshwiller is engaging even when most savage about male-female relationships.""—<i>Booklist</i></p>
<p>""Her fantastic premise allows Emshwiller canny and frequently hilarious insights into the damaging sex-role stereotypes both men and women perpetuate.""<br>
—<i>Publishers Weekly</i></p>
<p>The debut title in our Peapod Classics line, Carol Emshwiller’s genre-jumping debut novel is a dangerous, sharp-eyed look at men, women, and the world we live in.</p>
<p>Everything is changing: women are turning into animals, and animals are turning into women. Pooch, a golden setter, is turning into a beautiful woman—although she still has some of her canine traits: she just can't shuck that loyalty thing—and her former owner has turned into a snapping turtle. When the turtle tries to take a bite of her own baby, Pooch snatches the baby and runs. Meanwhile, there's a dangerous wolverine on the loose, men are desperately trying to figure out what's going on, and Pooch discovers what she really wants: to sing Carmen.</p>
<p><i>Carmen Dog</i> is the funny feminist classic that inspired writers Pat Murphy and Karen Joy Fowler to create the James Tiptree Jr. Memorial Award.</p>"
9781934137178,A Mathematician's Lament,"['Lockhart, Paul.']","<p>“One of the best critiques of current mathematics education I have ever seen.”—Keith Devlin, math columnist on NPR’s <i>Morning Edition</i></p>
<p>A brilliant research mathematician who has devoted his career to teaching kids reveals math to be creative and beautiful and rejects standard anxiety-producing teaching methods. Witty and accessible, Paul Lockhart’s controversial approach will provoke spirited debate among educators and parents alike and it will alter the way we think about math forever.</p>
<p><b>Paul Lockhart</b>, has taught mathematics at Brown University and UC Santa Cruz. Since 2000, he has dedicated himself to K-12 level students at St. Ann’s School in Brooklyn, New York.</p>"
9781933330747,Satoshi Kon: The Illusionist,"['Osmond', 'Andrew']","<p>“Satoshi Kon makes an art of Japanese anime.”—<i>Rolling Stone</i></p>
<p>The head-spinning anime fantasy <i>Paprika</i> (2006) introduced new viewers to one of Japan’s most visionary directors. Satoshi Kon crashed onto the world scene in 1997 with his smart slasher-thriller <i>Perfect Blue</i>. His subsequent films range from the silver-screen romance of <i>Millennium Actress</i> (2001) to the socially conscious comedy <i>Tokyo Godfathers</i> (2003) and the surreally satirical TV series <i>Paranoia Agent</i> (2004). This book provides a comprehensive introduction to the work and vision of Satoshi Kon, with background and analysis of the key reality-warping films by anime’s premier illusionist. This timely new collection follows the 2007 US release of Kon’s latest film, <i>Paprika</i>, which was met with an enthusiastic welcome from his fans. For many, <i>Paprika</i> was a first introduction to Kon’s work; other fans have been following his career avidly from its early days. <i>Satoshi Kon: The Illusionist</i> will satisfy newcomers and long-term fans alike.</p>
<p><b>Andrew Osmond</b> is a British freelance film reviewer and journalist who was part of the “Akira generation” of anime fans. He has been writing about cartoons and anime for ten years and has interviewed numerous anime professionals, including Satoshi Kon. His articles and reviews have appeared in <i>Animerica</i>, <i>Total Anime</i>, <i>Neo</i>, <i>Manga Max</i>, <i>SFX</i>, <i>Sight and Sound</i>, <i>Empire</i>, and many other magazines.</p>"
9781933503035,Arthritis: How To Stay Active And Relieve Your Pain,"['Barbara Stokes', 'Antoine Helewa']","<p>Addressing the growing number of individuals who suffer from this often debilitating ailment, this indispensable reference explains how to manage chronic or acute arthritis in straightforward language. Descriptions of the most common forms of arthritis and how they affect the body and its joints guide arthritis sufferers through the symptoms and show them how to manage their own treatment with the help of a health-care team. Self-management is emphasized and chapters cover topics such as pain management, working with health-care professionals, medication, exercise, surgery options, intimacy issues, emotional health, social interaction, and alternative treatments.</p>"
9781906868239,Bake!: Essential Techniques For Perfect Baking,['Nick Malgieri'],"<p>After 30 years of teaching and 8 cookbooks, Nick Malgieri is finally writing the book he's meant to—a collection of 20 essential techniques, with 3 to 5 variations thereof-outlining the easiest way to learn the essentials of baking. The 20 chapters cover all the main techniques of fine baking, starting with simple pastry dough and moving through puff pastry and Danish pastry, all sorts of breads, quick breads, cakes, and cookies.</p>"
9781933045382,Painting People: Figure Painting Today,"['Mullins, Charlotte.']","<p>After a century in which the lexicon of artists' materials expanded from the classic oil, canvas, stone and plaster to include photography, film, performance, found objects and concepts, the spotlight has finally swung back. A new generation of artists--as well as some who never abandoned figurative painting in the first place--is relishing the solitary, slow, subtle set of processes involved in not just painting, but painting people. They are choosing paint's unique ability to distill a lifetime of events rather than photography's glimpse of a frozen moment. <i>Painting People,</i> edited by the prominent London art historian and critic Charlotte Mullins, unites and contrasts the work of a key group of artists from around the world, and investigates their richly varied accomplishments in lucid text with detailed commentaries, accompanied by more than 150 reproductions. The list of contributing artists is stellar, ranging from photo-based painters like Luc Tuymans, Peter Doig and Marlene Dumas to Pop artists like Sigmar Polke and Alex Katz, photorealists like Chuck Close and Gerhard Richter, Neoexpressionists like Cecily Brown, and comics-inspired painters like Yoshitomo Nara, Inka Essenhigh and Takashi Murakami. There are erotic grotesques from John Currin and Lisa Yuskavage, meditations on the muse by Elizabeth Peyton and Lucian Freud, ""Repro-realistic"" work from Neo Rauch and of course self-portraits by Philip Akkerman and Marcel Dzama, among others.</p>"
9781933397900,Sweet Danger: Albert Campion #5,['Margery Allingham'],"<p>After centuries as a Balkan backwater, the sleepy town of Averna has'overnight'become a stunningly valuable port, thanks to an earthquake that rejiggered the regional topography. But to whose coffers will that value accrue? Albert Campion has a hunch that the answer is to be found in a tiny Suffolk village, where a peculiar?and dead broke?family may be able to lay claim to the Averna fortune, provided they can produce the requisite proof of lineage. The proof? Nothing terribly difficult: Just your average ancient riddle, stolen drum, long-lost bell, priceless crown, and, oh yes, a necklace of disappearing rubies.</p>"
9781908917720,Aim High,['Tanni Grey-Thompson'],"<p>Aim High is an inspirational book written by the UK’s leading wheelchair athlete, Dame Tanni Grey-Thompson. She has won 16 medals, eleven of which are gold, countless European titles, six London Marathons and over 30 world records have catapulted this Welsh wheelchair athlete so firmly into the public consciousness. Aim High reveals what has motivated her through her best and worst times.</p>"
9781933164731,Aoi House Omnibus 1 (v. 1),['Adam Arnold'],"<p>Alex and Sandy are two normal guys just trying to get through college—until their troublemaking hamster, Echiboo, gets them thrown out of their dorm. With nowhere else to turn, the boys move into an anime clubhouse where five crazed yaoi fangirls call the shots!</p>
<p>Elle's obsessively high-strung, Nina's too laid back for her own good, Jessica's a total tease, Maria's a shy and reserved bookworm, and Morgan's just plain bonkers! Toss 'em all together and you've got a harem comedy that's truly like none other!</p>
<p>Seven Seas is pleased to present this omnibus edition which contains Volumes 1 and 2 of <i>Aoi House</i> in one affordable collection!</p>"
9781934734209,"Life-size Zoo: From Tiny Rodents To Gigantic Elephants, An Actual-size Animal Encyclopedia",['Teruyuki Komiya'],"<p>An elephant's trunk is so nimble, it can pick up a single blade of grass, and yet so strong, it can knock over a tree. Giraffes have eyelashes. Sloths hang from trees for days at a time without going to the bathroom. These are just some of the insights featured in <i>Life-Size Zoo</i>. Acclaimed wildlife photographer Toyofumi Fukuda visited Japan's premier zoos to capture remarkably vivid and detailed close-up photographs of 21 animals, from pandas and meerkats to giraffes, rhinos, and elephants (adult and baby). Each photograph is accompanied by a profile including body length, weight, and natural habitat, as well as fun facts about the animal.</p>"
9781933415819,Cloth And Culture: Couture Creations By Ruth E. Funk,['Ruth E. Funk'],"<p>An illuminating exploration into the engaging world of artist Ruth E. Funk’s remarkable body of work, this beautifully compiled visual&nbsp;catalog is replete with brilliant imagery and layered with enlightening insights into her craft. This inspiring collection is complemented by the stunning photographic documentation of her work, showcasing Funk’s unique design aesthetic as applied to wearable art, her passion for the medium, and her innate understanding of evolving fashion. Exemplifying the artist’s versatile design techniques through her hand-sewn and embellished one-of-a-kind pieces—coupled with her vast knowledge of garment-making and fiber art jewelry—this delightful monograph is an authoritative historical documentation of a talented and beloved American artist’s contribution to the fiber and style community worldwide and an essential textile art guide for the design and fashion enthusiast.</p>"
9781908844019,The Assassin's Curse,['Cassandra Rose Clarke'],"<p>Ananna of the Tanarau abandons ship when her parents try to marry her off to an allying pirate clan: she wants to captain her own boat, not serve as second-in-command to her handsome yet clueless fiance. But her escape has dire consequences when she learns the scorned clan has sent an assassin after her.&nbsp;</p>
<p>And when the assassin, Naji, finally catches up with her, things get even worse. Ananna inadvertently triggers a nasty curse — with a life-altering result. Now Ananna and Naji are forced to become uneasy allies as they work together to break the curse and return their lives back to normal. Or at least as normal as the lives of a pirate and an assassin can be.</p>"
9781934716359,The Thin In 10 Weight-loss Plan: Transform Your Body (and Life!) In Minutes A Day,['Liz Neporent'],"<p>Are you looking for a way to lose weight and keep it off without committing to hours of exercise? Have you lost weight only to gain it back again? Do you struggle to find time to lose weight?</p>
<p>Best-selling exercise DVD star and certified fitness and lifestyle expert Jessica Smith, along with award-winning health and fitness writer Liz Neporent, break down weight loss into 10-minute, easy-to-follow workouts that fit your busy schedule. Step-by-step photos and instructions, along with an exciting, fast-paced DVD with six, 10-minute workouts, make this a simple, fun, and sustainable program for anyone, whether you're just starting out or have been at it for a while.</p>
<p>The Thin in 10 Weight-Loss Plan proves once and for all that you have time to work out. Getting fit, feeling good, and losing weight doesn't mean laboring for hours in a gym or spending hundreds of dollars on bulky high-tech equipment.</p>
<p>High- and low-intensity fat-burning and muscle-building exercises, along with healthful, easy (and quick) recipes, numerous tips and tricks to burning more calories throughout the day, and a bonus DVD, make this the essential fitness and weight-loss kit!</p>"
9781933390079,Race Forever (choose Your Own Adventure #7),['R. A. Montgomery'],"<p>As soon as you could see over the steering wheel of an SUV, your father began teaching you about cars and driving. He is a former racecar driver himself. You have planned this trip to Africa for months but at the last minute your dad has to cancel. You are on in Africa on your own, facing some of the toughest driving conditions in the world. And some of the most unscrupulous competitors...</p>
<p>The African countryside is filled with hazards and risks. The winner of the race will gain fame and even sponsorship. But flash floods, charging elephants, and the band of local guerrillas turn out to be the easy part. The drivers who will do anything—anything—to win may be the biggest danger of all.</p>


                        <p>The reader, as a young racing car driver, is selected to compete in the African Dual Road Race Rally. By choosing specific pages, the reader determines the outcome of the race.
</p>"
9781932748970,Paco Y La Planta De Chile Giga,['Keith Polette'],"<p>Based on the classic Jack and the Beanstalk, the desert Southwest is the unexpected setting for this retelling with a unique twist.</p>"
